mood_request,Suggest a book that makes you cry,"sad, tearjerker, heartbreaking, emotional"
mood_request,Recommend something thought-provoking,"thought-provoking, profound, deep, philosophical"
mood_request,Recommend a light-hearted book,"light-hearted, fun, breezy, cheerful"
mood_request,I'm in the mood for something intense,"intense, gripping, powerful, consuming"
mood_request,I'm in the mood for something dramatic,"dramatic, intense, emotional, theatrical"
mood_request,"I'm feeling adventurous, recommend a book","adventurous, daring, bold, exciting"
mood_request,I want a relaxing read,"relaxing, calming, peaceful, mellow"
reading_level,casual,light reads,"beach books, fluffy, entertainment",no heavy stuff,"easy-breezy, vacation reads",suggest a beach read,"light book, vacation novel",recommend something fluffy,"entertaining read, no heavy stuff"
reading_level,visual,recommend a graphic novel,"illustrated book, image-heavy","graphic novel, illustrated",Image-heavy books
reading_level,esl_intermediate,recommend an intermediate English book,"EFL practice, B1/B2 level",EFL intermediate,Intermediate English proficiency
reading_level,esl_beginner,suggest a book for English learners,"EFL starter, basic English",For English language learners
reading_level,academic,suggest a textbook,"university material, research book",recommend scholarly reads,"graduate-level, thesis material","scholarly, research, textbook",University-level material
reading_level,young_adult,YA books,"teen, adolescent, high school",books for teens,"coming-of-age, 13-18",suggest a YA book,"teen novel, high school read",recommend something for teens,"adolescent fiction, coming-of-age","YA, teen",Ages 13-18
reading_level,children,books for kids,"children's, juvenile, elementary",for a 10-year-old,"middle grade, tween",suggest a book for a 10-year-old,"kids book, middle grade novel",recommend a children's book,"juvenile fiction, ages 6-12","kids, juvenile, young readers",Ages 6-12
reading_level,advanced,challenging reads,"hard, complex, expert, literary",research-level books,"grad school, scholarly, academic",recommend a challenging book,"complex read, expert-level, literary",I want a book to test me,"grad school level, scholarly text","hard, challenging, level 3, complex",For experienced readers (college level+)
reading_level,intermediate,medium difficulty books,"moderate, stepping stone, bridge books",not too easy or hard,"goldilocks level, just right",suggest a book for casual readers,"medium book, stepping stone novel",I want something not too hard,"goldilocks book, just right level","moderate, level 2, standard, regular",Ideal for casual readers (9th-12th grade level)
reading_level,beginner,easy books,"simple, starter, newbie, introductory, basic",I'm just starting out,"first books, entry-level, for dummies",suggest a book to start reading,"first book, beginner book, easy read",I'm new to reading,"starter book, introductory novel, for dummies",recommend an easy book,"simple read, basic book, level 1","easy, starter, level 1, basic, introductory"
reading_level,large_print,suggest a large print book,"big text book, for visually impaired",big text,For visually impaired readers
Recommendations,reading level
Recommendations,mood
Recommendations,author
Recommendations,genre
